{
  "id": "msg_20260309_002",
  "thread_id": "thread_example_request_001",
  "type": "response",
  "from": "reviewer",
  "to": "orchestrator",
  "subject": "Review result",
  "body": "No blocking issues found. Residual risk: examples are not runtime-tested.",
  "artifacts": [
    "README.md"
  ],
  "status": "completed",
  "created_at": "2026-03-09T12:05:00.000Z",
  "reply_to": "msg_20260309_001"
}
